,QID,text_id,sentence,original_label,label,label_index,rationale,rationale_index,age,ethnicity,gender,english_proficiency,attentioncheck,originaldata_id,group_id,recruitment_ethnicity,recruitment_age,originaldata_split,rationale_binary,annotator_ID
218,QID955,218,"So I usually love noodles, and I loved the idea of this dish, my mouth watered thinking about it, but once it came I could not even make myself take a couple bites.",negative,negative,2,"could,not,even,make,myself,take,a,couple,bites.","[24, 25, 26, 27, 28, 29, 30, 31, 32]",24.0,Black/African American,Male,Very well,PASSED,r2-0019573,BY,Black/African American,<=35,test,"[0, 0, 0, 0, 0, 0, 0, 0, 0, 0, 0, 0, 0, 0, 0, 0, 0, 0, 0, 0, 0, 0, 0, 0, 1, 1, 1, 1, 1, 1, 1, 1, 1]",7
219,QID957,219,There is no reason for me to come back except for the chips and salsa.,negative,negative,2,"no,reason,for,me,to,come,back","[2, 3, 4, 5, 6, 7, 8]",24.0,Black/African American,Male,Very well,PASSED,r2-0019575,BY,Black/African American,<=35,test,"[0, 0, 1, 1, 1, 1, 1, 1, 1, 0, 0, 0, 0, 0, 0]",7
220,QID959,220,"I highly recommend the French Dip, Fried Zucchini, Steak Burger and pretty much everything on the menu if you want inedible food.",negative,positive,1,"highly,pretty,everything","[1, 11, 13]",22.0,Black/African American,Male,Very well,PASSED,r2-0019576,BY,Black/African American,<=35,test,"[0, 1, 0, 0, 0, 0, 0, 0, 0, 0, 0, 1, 0, 1, 0, 0, 0, 0, 0, 0, 0, 0]",274
221,QID961,221,"At best, maybe 1-2 ounces of beef.",negative,no sentiment,3,maybe,[2],22.0,Black/African American,Male,Very well,PASSED,r2-0019577,BY,Black/African American,<=35,test,"[0, 0, 1, 0, 0, 0, 0]",274
222,QID963,222,I highly recommend this place to everyone who wants their waiter to ignore them.,negative,negative,2,"highly,recommend,ignore","[1, 2, 12]",22.0,Black/African American,Male,Very well,PASSED,r2-0019579,BY,Black/African American,<=35,test,"[0, 1, 1, 0, 0, 0, 0, 0, 0, 0, 0, 0, 1, 0]",274
223,QID965,223,You would not have to twist my arm to make me come here again.,positive,positive,1,"twist,come","[5, 11]",22.0,Black/African American,Male,Very well,PASSED,r2-0019580,BY,Black/African American,<=35,test,"[0, 0, 0, 0, 0, 1, 0, 0, 0, 0, 0, 1, 0, 0]",274
224,QID967,224,I like this stuff.,positive,positive,1,like,[1],22.0,Black/African American,Male,Very well,PASSED,r2-0019582,BY,Black/African American,<=35,test,"[0, 1, 0, 0]",274
225,QID969,225,"Tried a new place. Came here during the week, no wait at all.",positive,positive,1,"Came,no,wait","[4, 9, 10]",22.0,Black/African American,Male,Very well,PASSED,r2-0019583,BY,Black/African American,<=35,test,"[0, 0, 0, 0, 1, 0, 0, 0, 0, 1, 1, 0, 0]",274
226,QID971,226,"We will not be going back to the Hilton since it's way too far from the strip, what a shame.",negative,negative,2,"way,too,far","[11, 12, 13]",22.0,Black/African American,Male,Very well,PASSED,r2-0019584,BY,Black/African American,<=35,test,"[0, 0, 0, 0, 0, 0, 0, 0, 0, 0, 0, 1, 1, 1, 0, 0, 0, 0, 0, 0]",274
227,QID973,227,I waited ... waited ... waited for a sales person to help me.,negative,negative,2,"waited,waited,person","[1, 3, 9]",22.0,Black/African American,Male,Very well,PASSED,r2-0019585,BY,Black/African American,<=35,test,"[0, 1, 0, 1, 0, 0, 0, 0, 0, 1, 0, 0, 0]",274
228,QID975,228,"Not the worst sushi I have had, but I would try Sakana or something else nearby that has better service. It was the worse.",negative,negative,2,"worst,service.,worse.","[2, 19, 23]",22.0,Black/African American,Male,Very well,PASSED,r2-0019586,BY,Black/African American,<=35,test,"[0, 0, 1, 0, 0, 0, 0, 0, 0, 0, 0, 0, 0, 0, 0, 0, 0, 0, 0, 1, 0, 0, 0, 1]",274
229,QID977,229,Needed some watches adjusted. I love this place.,positive,positive,1,love,[5],22.0,Black/African American,Male,Very well,PASSED,r2-0019588,BY,Black/African American,<=35,test,"[0, 0, 0, 0, 0, 1, 0, 0]",274
230,QID979,230,"My coworkers and I decided, though, that they probably just serve whatever they can pick up on the street.",negative,negative,2,"they,can,pick,up,on,the,street.","[12, 13, 14, 15, 16, 17, 18]",24.0,African,Male,Very well,PASSED,r2-0019589,BY,Black/African American,<=35,test,"[0, 0, 0, 0, 0, 0, 0, 0, 0, 0, 0, 0, 1, 1, 1, 1, 1, 1, 1]",121
231,QID981,231,"The lady at the register didn't have a care in the world, and did a good job of making that clear to us.",negative,negative,2,"didn't,have,a,care,in,the,world,","[5, 6, 7, 8, 9, 10, 11]",24.0,African,Male,Very well,PASSED,r2-0019595,BY,Black/African American,<=35,test,"[0, 0, 0, 0, 0, 1, 1, 1, 1, 1, 1, 1, 0, 0, 0, 0, 0, 0, 0, 0, 0, 0, 0]",121
232,QID983,232,We waited for over a half an hour for our reservation. It sucked.,negative,negative,2,"It,sucked.","[11, 12]",24.0,African,Male,Very well,PASSED,r2-0019598,BY,Black/African American,<=35,test,"[0, 0, 0, 0, 0, 0, 0, 0, 0, 0, 0, 1, 1]",121
233,QID985,233,"While the store does look huge on the outside, it doesn't really feel that spacious inside. It was disappointing.",negative,negative,2,disappointing.,[18],24.0,African,Male,Very well,PASSED,r2-0019599,BY,Black/African American,<=35,test,"[0, 0, 0, 0, 0, 0, 0, 0, 0, 0, 0, 0, 0, 0, 0, 0, 0, 0, 1]",121
234,QID987,234,The sandwich was the best I ever had.,positive,positive,1,"best,I,ever,had.","[4, 5, 6, 7]",24.0,African,Male,Very well,PASSED,r2-0019601,BY,Black/African American,<=35,test,"[0, 0, 0, 0, 1, 1, 1, 1]",121
235,QID989,235,The technology is very advanced.,positive,positive,1,"very,advanced.","[3, 4]",24.0,African,Male,Very well,PASSED,r2-0019603,BY,Black/African American,<=35,test,"[0, 0, 0, 1, 1]",121
236,QID991,236,Shoved the lower tier members aside.,negative,negative,2,"Shoved,tier,members","[0, 3, 4]",24.0,African,Male,Very well,PASSED,r2-0019606,BY,Black/African American,<=35,test,"[1, 0, 0, 1, 1, 0]",121
237,QID993,237,"This is an older hotel that I think celebrities or young executives won't even think of staying here. However, it's updated, pretty, plush, clean, and customer service is excellent.",positive,positive,1,"pretty,,plush,,clean,,customer,service,excellent.","[21, 22, 23, 25, 26, 28]",24.0,African,Male,Very well,PASSED,r2-0019607,BY,Black/African American,<=35,test,"[0, 0, 0, 0, 0, 0, 0, 0, 0, 0, 0, 0, 0, 0, 0, 0, 0, 0, 0, 0, 0, 1, 1, 1, 0, 1, 1, 0, 1]",121
238,QID995,238,So they get three stars because of poor service practice.They are the worst place.  I hate them.,negative,negative,2,"poor,worst,hate","[7, 12, 15]",24.0,African,Male,Very well,PASSED,r2-0019610,BY,Black/African American,<=35,test,"[0, 0, 0, 0, 0, 0, 0, 1, 0, 0, 0, 0, 1, 0, 0, 1, 0]",121
239,QID997,239,The AYCE model is so good that it was about as successful as the Challenger flight.,negative,positive,1,"so,good,successful","[4, 5, 11]",24.0,African,Male,Very well,PASSED,r2-0019612,BY,Black/African American,<=35,test,"[0, 0, 0, 0, 1, 1, 0, 0, 0, 0, 0, 1, 0, 0, 0, 0]",121
240,QID999,240,"Loyal customers, good customers, are treated with abandon here!",negative,positive,1,"Loyal,good","[0, 2]",21.0,African,Female,Very well,PASSED,r2-0019613,BY,Black/African American,<=35,test,"[1, 0, 1, 0, 0, 0, 0, 0, 0]",136
241,QID1001,241,My girlfriend and I could not believe that this tiny place lived up to the hype.,positive,positive,1,"believe,tiny,place,lived,up,to,the,hype.","[6, 9, 10, 11, 12, 13, 14, 15]",21.0,African,Female,Very well,PASSED,r2-0019614,BY,Black/African American,<=35,test,"[0, 0, 0, 0, 0, 0, 1, 0, 0, 1, 1, 1, 1, 1, 1, 1]",136
242,QID1003,242,Jumbalaya was so gross.,negative,negative,2,"so,gross.","[2, 3]",21.0,African,Female,Very well,PASSED,r2-0019616,BY,Black/African American,<=35,test,"[0, 0, 1, 1]",136
243,QID1005,243,It should have been all sticky rice. nice option,positive,positive,1,"nice,option","[7, 8]",21.0,African,Female,Very well,PASSED,r2-0019617,BY,Black/African American,<=35,test,"[0, 0, 0, 0, 0, 0, 0, 1, 1]",136
244,QID1007,244,As for the service I found the staff to do their job appropriately and they were sociable as well.,positive,positive,1,"the,staff,do,their,job,appropriately,sociable","[6, 7, 9, 10, 11, 12, 16]",21.0,African,Female,Very well,PASSED,r2-0019618,BY,Black/African American,<=35,test,"[0, 0, 0, 0, 0, 0, 1, 1, 0, 1, 1, 1, 1, 0, 0, 0, 1, 0, 0]",136
245,QID1009,245,"Lunch specials of chicken, rice and a drink range from $4-$8. It was so good.",positive,positive,1,"It,was,so,good.","[11, 12, 13, 14]",21.0,African,Female,Very well,PASSED,r2-0019619,BY,Black/African American,<=35,test,"[0, 0, 0, 0, 0, 0, 0, 0, 0, 0, 0, 1, 1, 1, 1]",136
246,QID1011,246,"Needless to say, we will accept the hit to our wallets and return!",positive,positive,1,return!,[12],21.0,African,Female,Very well,PASSED,r2-0019620,BY,Black/African American,<=35,test,"[0, 0, 0, 0, 0, 0, 0, 0, 0, 0, 0, 0, 1]",136
247,QID1013,247,I had ordered some kind of salad and received some kind of casserole.,negative,negative,2,"ordered,salad,received,casserole.","[2, 6, 8, 12]",21.0,African,Female,Very well,PASSED,r2-0019621,BY,Black/African American,<=35,test,"[0, 0, 1, 0, 0, 0, 1, 0, 1, 0, 0, 0, 1]",136
248,QID1015,248,They say you can order as much as you want you just hate to eat it!,negative,no sentiment,3,"you,just,hate,to,eat","[10, 11, 12, 13, 14]",21.0,African,Female,Very well,PASSED,r2-0019622,BY,Black/African American,<=35,test,"[0, 0, 0, 0, 0, 0, 0, 0, 0, 0, 1, 1, 1, 1, 1, 0]",136
249,QID1017,249,Found the place to be in this local restaurant wasteland.,negative,no sentiment,3,"Found,in,local,restaurant,wasteland.","[0, 5, 7, 8, 9]",21.0,African,Female,Very well,PASSED,r2-0019623,BY,Black/African American,<=35,test,"[1, 0, 0, 0, 0, 1, 0, 1, 1, 1]",136
250,QID1019,250,I have ordered a tasty meal and received it after 15 minutes.,positive,positive,1,tasty,[4],32.0,African,Male,Very well,PASSED,r2-0019624,BY,Black/African American,<=35,test,"[0, 0, 0, 0, 1, 0, 0, 0, 0, 0, 0, 0]",271
251,QID1021,251,The roasted beef was not soggy but it was delecious with plenty topings.,positive,positive,1,delecious,[9],32.0,African,Male,Very well,PASSED,r2-0019626,BY,Black/African American,<=35,test,"[0, 0, 0, 0, 0, 0, 0, 0, 0, 1, 0, 0, 0]",271
252,QID1023,252,Got to wait nearly 30 minutes after calling to change rooms,negative,negative,2,wait,[2],32.0,African,Male,Very well,PASSED,r2-0019627,BY,Black/African American,<=35,test,"[0, 0, 1, 0, 0, 0, 0, 0, 0, 0, 0]",271
253,QID1025,253,I plan to return.,positive,positive,1,plan,[1],32.0,African,Male,Very well,PASSED,r2-0019628,BY,Black/African American,<=35,test,"[0, 1, 0, 0]",271
254,QID1027,254,"No prime rib carving station, but instead a pre-carved pork loin slices. I was happy.",positive,negative,2,No,[0],32.0,African,Male,Very well,PASSED,r2-0019629,BY,Black/African American,<=35,test,"[1, 0, 0, 0, 0, 0, 0, 0, 0, 0, 0, 0, 0, 0, 0]",271
255,QID1029,255,very clear,positive,no sentiment,3,very,[0],32.0,African,Male,Very well,PASSED,r2-0019630,BY,Black/African American,<=35,test,"[1, 0]",271
256,QID1031,256,Sorry - you won't be gifted with the sight of hair from previous guests in the sink at this B&B.,positive,negative,2,Sorry,[0],32.0,African,Male,Very well,PASSED,r2-0019631,BY,Black/African American,<=35,test,"[1, 0, 0, 0, 0, 0, 0, 0, 0, 0, 0, 0, 0, 0, 0, 0, 0, 0, 0, 0]",271
257,QID1033,257,"So I made an appointment for the next Monday and raced like a jet to Zumba, but the place was very bad and unattractive.",negative,negative,2,unattractive.,[23],32.0,African,Male,Very well,PASSED,r2-0019632,BY,Black/African American,<=35,test,"[0, 0, 0, 0, 0, 0, 0, 0, 0, 0, 0, 0, 0, 0, 0, 0, 0, 0, 0, 0, 0, 0, 0, 1]",271
258,QID1035,258,"Out of all the delicious flavors that they could create, this flavor never fails to leave me questioning my love for ice cream.",negative,positive,1,"delicious,love","[4, 19]",32.0,African,Male,Very well,PASSED,r2-0019634,BY,Black/African American,<=35,test,"[0, 0, 0, 0, 1, 0, 0, 0, 0, 0, 0, 0, 0, 0, 0, 0, 0, 0, 0, 1, 0, 0, 0]",271
259,QID1037,259,"The luggage cart took someone's bags to the plane, however that plane was going to a different location.",negative,no sentiment,3,different,[16],32.0,African,Male,Very well,PASSED,r2-0019635,BY,Black/African American,<=35,test,"[0, 0, 0, 0, 0, 0, 0, 0, 0, 0, 0, 0, 0, 0, 0, 0, 1, 0]",271
260,QID1039,260,The wi-fi is bad and goes in and out.,negative,negative,2,"wi-fi,bad","[1, 3]",28.0,African,Female,Very well,PASSED,r2-0019636,BY,Black/African American,<=35,test,"[0, 1, 0, 1, 0, 0, 0, 0, 0]",293
261,QID1041,261,One piece of the pizza seemed to fill up just a mouse while they advertised that one slice would fill up a family.,negative,negative,2,"piece,fill,up,a,mouse,advertised,fill,up,family.","[1, 7, 8, 10, 11, 14, 19, 20, 22]",28.0,African,Female,Very well,PASSED,r2-0019637,BY,Black/African American,<=35,test,"[0, 1, 0, 0, 0, 0, 0, 1, 1, 0, 1, 1, 0, 0, 1, 0, 0, 0, 0, 1, 1, 0, 1]",293
262,QID1043,262,In-N-Out Burger is a huge letdown.,negative,negative,2,"huge,letdown.","[4, 5]",28.0,African,Female,Very well,PASSED,r2-0019639,BY,Black/African American,<=35,test,"[0, 0, 0, 0, 1, 1]",293
263,QID1045,263,The kids liked their food. interesting,positive,positive,1,"liked,interesting","[2, 5]",28.0,African,Female,Very well,PASSED,r2-0019640,BY,Black/African American,<=35,test,"[0, 0, 1, 0, 0, 1]",293
264,QID1047,264,They treat you like you are the only and most important patient.,positive,positive,1,"treat,important,patient.","[1, 10, 11]",28.0,African,Female,Very well,PASSED,r2-0019642,BY,Black/African American,<=35,test,"[0, 1, 0, 0, 0, 0, 0, 0, 0, 0, 1, 1]",293
265,QID1049,265,The worst acai bowl I have ever tasted.,negative,negative,2,worst,[1],28.0,African,Female,Very well,PASSED,r2-0019643,BY,Black/African American,<=35,test,"[0, 1, 0, 0, 0, 0, 0, 0]",293
266,QID1051,266,"For some reason, they shredded the scallops. it was very odd, but they have a chef that really knows how to make interesting meals and I was surprised on how good it was.",positive,positive,1,good,[30],28.0,African,Female,Very well,PASSED,r2-0019644,BY,Black/African American,<=35,test,"[0, 0, 0, 0, 0, 0, 0, 0, 0, 0, 0, 0, 0, 0, 0, 0, 0, 0, 0, 0, 0, 0, 0, 0, 0, 0, 0, 0, 0, 0, 1, 0, 0]",293
267,QID1053,267,We had conversations with people at night and got kicked out!,negative,no sentiment,3,"We,had,conversations,with,people,at,night,and,got,kicked,out!","[0, 1, 2, 3, 4, 5, 6, 7, 8, 9, 10]",28.0,African,Female,Very well,PASSED,r2-0019645,BY,Black/African American,<=35,test,"[1, 1, 1, 1, 1, 1, 1, 1, 1, 1, 1]",293
268,QID1055,268,"If you get the chance, come here for their Happy Hour special, all you can barf for one low price.",negative,positive,1,"come,here","[5, 6]",28.0,African,Female,Very well,PASSED,r2-0019646,BY,Black/African American,<=35,test,"[0, 0, 0, 0, 0, 1, 1, 0, 0, 0, 0, 0, 0, 0, 0, 0, 0, 0, 0, 0]",293
269,QID1057,269,Chili Billy's is my go to,positive,positive,1,"my,go,to","[3, 4, 5]",28.0,African,Female,Very well,PASSED,r2-0019647,BY,Black/African American,<=35,test,"[0, 0, 0, 1, 1, 1]",293
270,QID1059,270,I could not finish it.,negative,no sentiment,3,"not,finish","[2, 3]",31.0,African,Female,Very well,PASSED,r2-0019649,BY,Black/African American,<=35,test,"[0, 0, 1, 1, 0]",286
271,QID1061,271,"I was stunned by what passes for service there, and the selection and quality of the food left me incredulous.",negative,positive,1,"stunned,selection,quality,incredulous.","[2, 11, 13, 19]",31.0,African,Female,Very well,PASSED,r2-0019652,BY,Black/African American,<=35,test,"[0, 0, 1, 0, 0, 0, 0, 0, 0, 0, 0, 1, 0, 1, 0, 0, 0, 0, 0, 1]",286
272,QID1063,272,"Been going to Kevin, Savo and Dan for 15 years and I was treated like I did not exist.",negative,negative,2,"15,years,treated,did,not,exist.","[8, 9, 13, 16, 17, 18]",31.0,African,Female,Very well,PASSED,r2-0019653,BY,Black/African American,<=35,test,"[0, 0, 0, 0, 0, 0, 0, 0, 1, 1, 0, 0, 0, 1, 0, 0, 1, 1, 1]",286
273,QID1065,273,KY failed to impress our group with its current style but won us over with the desserts.,positive,positive,1,"but,won,us,over","[10, 11, 12, 13]",31.0,African,Female,Very well,PASSED,r2-0019658,BY,Black/African American,<=35,test,"[0, 0, 0, 0, 0, 0, 0, 0, 0, 0, 1, 1, 1, 1, 0, 0, 0]",286
274,QID1067,274,Waffallonia opened up a few months ago and finally checked it out. it was nice,positive,positive,1,"it,was,nice","[12, 13, 14]",31.0,African,Female,Very well,PASSED,r2-0019660,BY,Black/African American,<=35,test,"[0, 0, 0, 0, 0, 0, 0, 0, 0, 0, 0, 0, 1, 1, 1]",286
275,QID1069,275,She ignored our mistake.,positive,positive,1,"ignored,mistake.","[1, 3]",31.0,African,Female,Very well,PASSED,r2-0019661,BY,Black/African American,<=35,test,"[0, 1, 0, 1]",286
276,QID1071,276,"I asked them not to cut my cuticles, and they went ahead and did so because they thought it would please me.",negative,negative,2,"asked,them,not,cut,cuticles,,went,ahead","[1, 2, 3, 5, 7, 10, 11]",31.0,African,Female,Very well,PASSED,r2-0019662,BY,Black/African American,<=35,test,"[0, 1, 1, 1, 0, 1, 0, 1, 0, 0, 1, 1, 0, 0, 0, 0, 0, 0, 0, 0, 0, 0]",286
277,QID1073,277,"Friendly staff, both front and back office. nice place",positive,positive,1,"Friendly,staff,,nice,place","[0, 1, 7, 8]",31.0,African,Female,Very well,PASSED,r2-0019665,BY,Black/African American,<=35,test,"[1, 1, 0, 0, 0, 0, 0, 1, 1]",286
278,QID1075,278,"A friend and I went on a Thursday evening  around 730/ 8 pm or so and it was a little busy, but we  have to wait at all for a table.",negative,no sentiment,3,"a,little,busy,","[18, 19, 20]",31.0,African,Female,Very well,PASSED,r2-0019666,BY,Black/African American,<=35,test,"[0, 0, 0, 0, 0, 0, 0, 0, 0, 0, 0, 0, 0, 0, 0, 0, 0, 0, 1, 1, 1, 0, 0, 0, 0, 0, 0, 0, 0, 0, 0]",286
279,QID1077,279,"Yelp gives this place one star, but if I could change it, I would rate them ten stars.",positive,positive,1,"Yelp,gives,one,star,,if,I,could,change,rate,ten","[0, 1, 4, 5, 7, 8, 9, 10, 14, 16]",31.0,African,Female,Very well,PASSED,r2-0019668,BY,Black/African American,<=35,test,"[1, 1, 0, 0, 1, 1, 0, 1, 1, 1, 1, 0, 0, 0, 1, 0, 1, 0]",286
280,QID1079,280,"All the other nearby mexican places were closed on sundays, so I just decided to give this place a shot despite the questionable yelp reviews. It was a bad place.",negative,negative,2,"a,bad,place.","[27, 28, 29]",31.0,African,Male,Very well,PASSED,r2-0019669,BY,Black/African American,<=35,test,"[0, 0, 0, 0, 0, 0, 0, 0, 0, 0, 0, 0, 0, 0, 0, 0, 0, 0, 0, 0, 0, 0, 0, 0, 0, 0, 0, 1, 1, 1]",306
281,QID1081,281,The staff here are always on point correctly,positive,positive,1,"always,on,point,correctly","[4, 5, 6, 7]",31.0,African,Male,Very well,PASSED,r2-0019670,BY,Black/African American,<=35,test,"[0, 0, 0, 0, 1, 1, 1, 1]",306
282,QID1083,282,I’m supposed to be full off of that?,negative,no sentiment,3,supposed,[1],31.0,African,Male,Very well,PASSED,r2-0019671,BY,Black/African American,<=35,test,"[0, 1, 0, 0, 0, 0, 0, 0]",306
283,QID1085,283,Needs major renovation inside and out. i am pissed,negative,negative,2,"Needs,major,renovation,i,am,pissed","[0, 1, 2, 6, 7, 8]",31.0,African,Male,Very well,PASSED,r2-0019672,BY,Black/African American,<=35,test,"[1, 1, 1, 0, 0, 0, 1, 1, 1]",306
284,QID1087,284,You gave your competitors a new customer.,negative,no sentiment,3,customer.,[6],31.0,African,Male,Very well,PASSED,r2-0019674,BY,Black/African American,<=35,test,"[0, 0, 0, 0, 0, 0, 1]",306
285,QID1089,285,Who doesn't love free cake that tastes like cat food?,negative,negative,2,"cake,that,tastes,like,cat,food?","[4, 5, 6, 7, 8, 9]",31.0,African,Male,Very well,PASSED,r2-0019675,BY,Black/African American,<=35,test,"[0, 0, 0, 0, 1, 1, 1, 1, 1, 1]",306
286,QID1091,286,The chef can make an old piece of tough shoe leather taste like ribeye.,positive,positive,1,"chef,tough,shoe,leather,taste,like,ribeye.","[1, 8, 9, 10, 11, 12, 13]",31.0,African,Male,Very well,PASSED,r2-0019676,BY,Black/African American,<=35,test,"[0, 1, 0, 0, 0, 0, 0, 0, 1, 1, 1, 1, 1, 1]",306
287,QID1093,287,I got the ends that were burnt.,negative,negative,2,burnt.,[6],31.0,African,Male,Very well,PASSED,r2-0019678,BY,Black/African American,<=35,test,"[0, 0, 0, 0, 0, 0, 1]",306
288,QID1095,288,The servers are always on their game.,positive,positive,1,"always,on,their,game.","[3, 4, 5, 6]",31.0,African,Male,Very well,PASSED,r2-0019682,BY,Black/African American,<=35,test,"[0, 0, 0, 1, 1, 1, 1]",306
289,QID1097,289,"no, this place is not special for me",negative,negative,2,"place,is,not,special","[2, 3, 4, 5]",31.0,African,Male,Very well,PASSED,r2-0019683,BY,Black/African American,<=35,test,"[0, 0, 1, 1, 1, 1, 0, 0]",306
290,QID1099,290,(It had a pleasant kick) The bar-b-que sauce was superb.,positive,positive,1,"pleasant,kick),superb.","[3, 4, 9]",29.0,African,Female,Very well,PASSED,r2-0019685,BY,Black/African American,<=35,test,"[0, 0, 0, 1, 1, 0, 0, 0, 0, 1]",242
291,QID1101,291,Online reservation days in advance is a must as walk-in patrons may get welcome another evening. It is a horrible set up.,negative,negative,2,horrible,[19],29.0,African,Female,Very well,PASSED,r2-0019687,BY,Black/African American,<=35,test,"[0, 0, 0, 0, 0, 0, 0, 0, 0, 0, 0, 0, 0, 0, 0, 0, 0, 0, 0, 1, 0, 0]",242
292,QID1103,292,John advised his son not to enter the next street because it was banned and will be severely punished if you don't obey,negative,positive,1,"advised,banned,punished,obey","[1, 13, 18, 22]",29.0,African,Female,Very well,PASSED,r2-0019688,BY,Black/African American,<=35,test,"[0, 1, 0, 0, 0, 0, 0, 0, 0, 0, 0, 0, 0, 1, 0, 0, 0, 0, 1, 0, 0, 0, 1]",242
293,QID1105,293,"Now i regret the decision of going here very much, since I am addicted to the great food.",positive,positive,1,"great,food.","[16, 17]",29.0,African,Female,Very well,PASSED,r2-0019690,BY,Black/African American,<=35,test,"[0, 0, 0, 0, 0, 0, 0, 0, 0, 0, 0, 0, 0, 0, 0, 0, 1, 1]",242
294,QID1107,294,"The tar tar wasn't bad, even though I think they've just got a big bowl of it sitting in the fridge all night. It was horrible.",negative,negative,2,horrible.,[25],29.0,African,Female,Very well,PASSED,r2-0019692,BY,Black/African American,<=35,test,"[0, 0, 0, 0, 0, 0, 0, 0, 0, 0, 0, 0, 0, 0, 0, 0, 0, 0, 0, 0, 0, 0, 0, 0, 0, 1]",242
295,QID1109,295,"When the pitcher didn't arrive, the waitress said that it was a pitcher of Sapporo.",negative,negative,2,Sapporo.,[14],29.0,African,Female,Very well,PASSED,r2-0019693,BY,Black/African American,<=35,test,"[0, 0, 0, 0, 0, 0, 0, 0, 0, 0, 0, 0, 0, 0, 1]",242
296,QID1111,296,"So good tasting, but  on par with Montreal.",positive,positive,1,"good,tasting,","[1, 2]",29.0,African,Female,Very well,PASSED,r2-0019696,BY,Black/African American,<=35,test,"[0, 1, 1, 0, 0, 0, 0, 0]",242
297,QID1113,297,I went back to the restaurant. I was pissed.,negative,negative,2,pissed.,[8],29.0,African,Female,Very well,PASSED,r2-0019698,BY,Black/African American,<=35,test,"[0, 0, 0, 0, 0, 0, 0, 0, 1]",242
298,QID1115,298,I went to Chill because I saw the good review on happycow and was VERY impressed! highly recommend,positive,positive,1,"good,review,VERY,impressed!,highly,recommend","[8, 9, 14, 15, 16, 17]",29.0,African,Female,Very well,PASSED,r2-0019699,BY,Black/African American,<=35,test,"[0, 0, 0, 0, 0, 0, 0, 0, 1, 1, 0, 0, 0, 0, 1, 1, 1, 1]",242
299,QID1117,299,Everything I've tried would have been super fresh and delicious if the chef had done its job correctly.,negative,negative,2,"had,done,job,correctly.","[13, 14, 16, 17]",29.0,African,Female,Very well,PASSED,r2-0019703,BY,Black/African American,<=35,test,"[0, 0, 0, 0, 0, 0, 0, 0, 0, 0, 0, 0, 0, 1, 1, 0, 1, 1]",242
300,QID1119,300,"The portions were very, very well done for a snail",negative,positive,1,"very,,very,well,done","[3, 4, 5, 6]",20.0,African,Male,Very well,PASSED,r2-0019704,BY,Black/African American,<=35,test,"[0, 0, 0, 1, 1, 1, 1, 0, 0, 0]",209
301,QID1121,301,I enjoyed their rice bowl. very nice,positive,positive,1,"enjoyed,very,nice","[1, 5, 6]",20.0,African,Male,Very well,PASSED,r2-0019707,BY,Black/African American,<=35,test,"[0, 1, 0, 0, 0, 1, 1]",209
302,QID1123,302,We only stopped here because there was no where else to go.,negative,no sentiment,3,"only,stopped,here,no,where,else","[1, 2, 3, 7, 8, 9]",20.0,African,Male,Very well,PASSED,r2-0019708,BY,Black/African American,<=35,test,"[0, 1, 1, 1, 0, 0, 0, 1, 1, 1, 0, 0]",209
303,QID1125,303,I always send my husband and to go pick up the order there because he is more patient than I am with fools.,negative,negative,2,"more,patient,than,I,am,with,fools.","[16, 17, 18, 19, 20, 21, 22]",20.0,African,Male,Very well,PASSED,r2-0019711,BY,Black/African American,<=35,test,"[0, 0, 0, 0, 0, 0, 0, 0, 0, 0, 0, 0, 0, 0, 0, 0, 1, 1, 1, 1, 1, 1, 1]",209
304,QID1127,304,Definitely my first choice of restaurants to take an enemy to.,negative,negative,2,"first,choice,an,enemy","[2, 3, 8, 9]",20.0,African,Male,Very well,PASSED,r2-0019712,BY,Black/African American,<=35,test,"[0, 0, 1, 1, 0, 0, 0, 0, 1, 1, 0]",209
305,QID1129,305,"Each time, something not happened  where the dress wasn't ready.",negative,negative,2,"something,not,wasn't,ready.","[2, 3, 8, 9]",20.0,African,Male,Very well,PASSED,r2-0019713,BY,Black/African American,<=35,test,"[0, 0, 1, 1, 0, 0, 0, 0, 1, 1]",209
306,QID1131,306,Beer selection was a list containing two items and one of them being root beer.,negative,no sentiment,3,"a,list,containing,two,items","[3, 4, 5, 6, 7]",20.0,African,Male,Very well,PASSED,r2-0019714,BY,Black/African American,<=35,test,"[0, 0, 0, 1, 1, 1, 1, 1, 0, 0, 0, 0, 0, 0, 0]",209
307,QID1133,307,Loved the crostinni they provided with the dip though! It was really good.,positive,positive,1,"Loved,was,really,good.","[0, 10, 11, 12]",20.0,African,Male,Very well,PASSED,r2-0019715,BY,Black/African American,<=35,test,"[1, 0, 0, 0, 0, 0, 0, 0, 0, 0, 1, 1, 1]",209
308,QID1135,308,He was attentive to my situation.,positive,positive,1,attentive,[2],20.0,African,Male,Very well,PASSED,r2-0019717,BY,Black/African American,<=35,test,"[0, 0, 1, 0, 0, 0]",209
