,QID,text_id,sentence,original_label,label,label_index,rationale,rationale_index,age,ethnicity,gender,english_proficiency,attentioncheck,Zuco_id,group_id,recruitment_ethnicity,recruitment_age,sst2_id,sst2_split,rationale_binary,annotator_ID
108,QID795,138,"It's a hoot watching The Rock chomp on jumbo ants, pull an arrow out of his back, and leap unscathed through raging fire!",positive,no sentiment,3,hoot,[2],24,Black/African American,Female,Very well,PASSED,496,BY,Black/African American,<=35,5863,train,"[0, 0, 1, 0, 0, 0, 0, 0, 0, 0, 0, 0, 0, 0, 0, 0, 0, 0, 0, 0, 0, 0, 0]",193
109,QID639,60,"... a solid, well-formed satire.",positive,positive,1,"solid,,well-formed,satire.","[2, 3, 4]",27,African,Female,Very well,PASSED,389,BY,Black/African American,<=35,6153,train,"[0, 0, 1, 1, 1]",123
110,QID671,76,Feels less like a cousin to Blade Runner than like a bottom-feeder sequel in the Escape From New York series.,negative,no sentiment,3,"cousin,to,Blade,Runner","[4, 5, 6, 7]",28,African,Male,Very well,PASSED,412,BY,Black/African American,<=35,6956,train,"[0, 0, 0, 0, 1, 1, 1, 1, 0, 0, 0, 0, 0, 0, 0, 0, 0, 0, 0, 0]",166
111,QID889,185,"The director, with his fake backdrops and stately pacing, never settles on a consistent tone.",negative,negative,2,"director,,fake,backdrops,stately,pacing,,never,settles,consistent,tone.","[1, 4, 5, 7, 8, 9, 10, 13, 14]",32,African,Female,Very well,PASSED,568,BY,Black/African American,<=35,7076,train,"[0, 1, 0, 0, 1, 1, 0, 1, 1, 1, 1, 0, 0, 1, 1]",198
112,QID969,225,Godard's ode to tackling life's wonderment is a rambling and incoherent manifesto about the vagueness of topical excess... In Praise of Love remains a ponderous and pretentious endeavor that's unfocused and tediously exasperating.,negative,negative,2,"rambling,incoherent,ponderous,pretentious,unfocused,tediously,exasperating.","[8, 10, 24, 26, 29, 31, 32]",27,African,Female,Very well,PASSED,644,BY,Black/African American,<=35,7290,train,"[0, 0, 0, 0, 0, 0, 0, 0, 1, 0, 1, 0, 0, 0, 0, 0, 0, 0, 0, 0, 0, 0, 0, 0, 1, 0, 1, 0, 0, 1, 0, 1, 1]",197
113,QID999,240,"A profoundly stupid affair, populating its hackneyed and meanspirited storyline with cardboard characters and performers who value cash above credibility.",negative,negative,2,"stupid,hackneyed,meanspirited,storyline,cardboard,characters,value,cash,above,credibility.","[2, 6, 8, 9, 11, 12, 16, 17, 18, 19]",25,African,Female,Very well,PASSED,668,BY,Black/African American,<=35,7513,train,"[0, 0, 1, 0, 0, 0, 1, 0, 1, 1, 0, 1, 1, 0, 0, 0, 1, 1, 1, 1]",169
114,QID905,193,"The delicious trimmings... arrive early and stay late, filling nearly every minute... with a lighthearted glow, some impudent snickers, and a glorious dose of humankind's liberating ability to triumph over a Scrooge or two.",positive,positive,1,triumph,[28],23,African,Female,Very well,PASSED,579,BY,Black/African American,<=35,7615,train,"[0, 0, 0, 0, 0, 0, 0, 0, 0, 0, 0, 0, 0, 0, 0, 0, 0, 0, 0, 0, 0, 0, 0, 0, 0, 0, 0, 0, 1, 0, 0, 0, 0, 0]",131
115,QID759,120,A small movie with a big impact.,positive,positive,1,"big,impact.","[5, 6]",24,African,Male,Very well,PASSED,471,BY,Black/African American,<=35,7709,train,"[0, 0, 0, 0, 0, 1, 1]",165
116,QID597,39,... something appears to have been lost in the translation this time.,negative,negative,2,"lost,in,translation","[6, 7, 9]",21,Black/African American,Female,Very well,PASSED,359,BY,Black/African American,<=35,7967,train,"[0, 0, 0, 0, 0, 0, 1, 1, 0, 1, 0, 0]",101
117,QID851,166,The film is darkly funny in its observation of just how much more grueling and time-consuming the illusion of work is than actual work.,positive,no sentiment,3,"time-consuming,actual,work.","[15, 22, 23]",22,African,Female,Very well,PASSED,535,BY,Black/African American,<=35,8114,train,"[0, 0, 0, 0, 0, 0, 0, 0, 0, 0, 0, 0, 0, 0, 0, 1, 0, 0, 0, 0, 0, 0, 1, 1]",202
118,QID587,34,"I did go back and check out the last 10 minutes, but these were more repulsive than the first 30 or 40 minutes.",negative,negative,2,repulsive,[15],21,Black/African American,Female,Very well,PASSED,352,BY,Black/African American,<=35,8170,train,"[0, 0, 0, 0, 0, 0, 0, 0, 0, 0, 0, 0, 0, 0, 0, 1, 0, 0, 0, 0, 0, 0, 0]",101
119,QID793,137,``Simone'' is a fun and funky look into an artificial creation in a world that thrives on artificiality.,positive,positive,1,"fun,funky,creation","[3, 5, 10]",24,Black/African American,Female,Very well,PASSED,495,BY,Black/African American,<=35,8193,train,"[0, 0, 0, 1, 0, 1, 0, 0, 0, 0, 1, 0, 0, 0, 0, 0, 0, 0]",193
120,QID775,128,"A colorful, vibrant introduction to a universal human impulse, lushly photographed and beautifully recorded.",positive,positive,1,"colorful,,vibrant,introduction,lushly,photographed,beautifully","[1, 2, 3, 9, 10, 12]",24,African,Male,Very well,PASSED,484,BY,Black/African American,<=35,8273,train,"[0, 1, 1, 1, 0, 0, 0, 0, 0, 1, 1, 0, 1, 0]",165
121,QID723,102,Allen's funniest and most likeable movie in years.,positive,positive,1,"funniest,movie","[1, 5]",24,Black/African American,Female,Very well,PASSED,452,BY,Black/African American,<=35,8739,train,"[0, 1, 0, 0, 0, 1, 0, 0]",149
122,QID693,87,"A fiercely clever and subtle film, capturing the precarious balance between the extravagant confidence of the exiled aristocracy and the cruel earnestness of the victorious revolutionaries.",positive,positive,1,"clever,capturing,extravagant,confidence,victorious","[2, 6, 12, 13, 24]",30,African,Male,Well,PASSED,429,BY,Black/African American,<=35,8873,train,"[0, 0, 1, 0, 0, 0, 1, 0, 0, 0, 0, 0, 1, 1, 0, 0, 0, 0, 0, 0, 0, 0, 0, 0, 1, 0]",150
123,QID971,226,"We never truly come to care about the main characters and whether or not they'll wind up together, and Michele's spiritual quest is neither amusing nor dramatic enough to sustain interest.",negative,negative,2,"neither,amusing,dramatic,enough,sustain,interest.","[23, 24, 26, 27, 29, 30]",27,African,Female,Very well,PASSED,646,BY,Black/African American,<=35,9141,train,"[0, 0, 0, 0, 0, 0, 0, 0, 0, 0, 0, 0, 0, 0, 0, 0, 0, 0, 0, 0, 0, 0, 0, 1, 1, 0, 1, 1, 0, 1, 1]",197
124,QID957,219,... about as exciting to watch as two last-place basketball teams playing one another on the final day of the season.,negative,negative,2,last-place,[8],26,African,Female,Very well,PASSED,629,BY,Black/African American,<=35,9194,train,"[0, 0, 0, 0, 0, 0, 0, 0, 1, 0, 0, 0, 0, 0, 0, 0, 0, 0, 0, 0, 0]",114
125,QID665,73,"Gosling creates a staggeringly compelling character, a young man whose sharp intellect is at the very root of his contradictory, self-hating, self-destructive ways.",positive,positive,1,"Gosling,creates,staggeringly,compelling,character,","[0, 1, 3, 4, 5]",28,African,Male,Very well,PASSED,409,BY,Black/African American,<=35,9219,train,"[1, 1, 0, 1, 1, 1, 0, 0, 0, 0, 0, 0, 0, 0, 0, 0, 0, 0, 0, 0, 0, 0, 0]",166
127,QID605,43,Everything was as superficial as the forced New Jersey lowbrow accent Uma had.,negative,negative,2,"superficial,forced","[3, 6]",25,African,Female,Very well,PASSED,364,BY,Black/African American,<=35,11118,train,"[0, 0, 0, 1, 0, 0, 1, 0, 0, 0, 0, 0, 0]",174
128,QID667,74,"I thought the relationships were wonderful, the comedy was funny, and the love `real'.",positive,positive,1,"relationships,wonderful,,funny,,love,`real'.","[3, 5, 9, 12, 13]",28,African,Male,Very well,PASSED,410,BY,Black/African American,<=35,11703,train,"[0, 0, 0, 1, 0, 1, 0, 0, 0, 1, 0, 0, 1, 1]",166
129,QID997,239,Griffin & Co. manage to be spectacularly outrageous.,positive,positive,1,"spectacularly,outrageous.","[6, 7]",25,African,Female,Very well,PASSED,667,BY,Black/African American,<=35,12341,train,"[0, 0, 0, 0, 0, 0, 1, 1]",169
130,QID689,85,It's a great American adventure and a wonderful film to bring to IMAX.,positive,positive,1,"great,adventure,wonderful","[2, 4, 7]",30,African,Male,Well,PASSED,425,BY,Black/African American,<=35,12370,train,"[0, 0, 1, 0, 1, 0, 0, 1, 0, 0, 0, 0, 0]",150
131,QID1019,250,"The art direction is often exquisite, and the anthropomorphic animal characters are beautifully realized through clever makeup design, leaving one to hope that the eventual DVD release will offer subtitles and the original Italian-language soundtrack.",positive,positive,1,direction,[2],27,Black/African American,Male,Very well,PASSED,681,BY,Black/African American,<=35,12467,train,"[0, 0, 1, 0, 0, 0, 0, 0, 0, 0, 0, 0, 0, 0, 0, 0, 0, 0, 0, 0, 0, 0, 0, 0, 0, 0, 0, 0, 0, 0, 0, 0, 0, 0, 0]",143
132,QID629,55,"One of the finest, most humane and important Holocaust movies ever made.",positive,no sentiment,3,"movies,ever","[9, 10]",30,African,Female,Very well,PASSED,382,BY,Black/African American,<=35,13237,train,"[0, 0, 0, 0, 0, 0, 0, 0, 0, 1, 1, 0]",138
133,QID861,171,"In addition to scoring high for originality of plot -- putting together familiar themes of family, forgiveness and love in a new way -- Lilo & Stitch has a number of other assets to commend it to movie audiences both innocent and jaded.",positive,positive,1,"scoring,high,for,originality,in,a,new,way,assets,to,commend,it,to,movie,audiences","[3, 4, 5, 6, 19, 20, 21, 22, 32, 33, 34, 35, 36, 37, 38]",30,African,Male,Very well,PASSED,545,BY,Black/African American,<=35,13621,train,"[0, 0, 0, 1, 1, 1, 1, 0, 0, 0, 0, 0, 0, 0, 0, 0, 0, 0, 0, 1, 1, 1, 1, 0, 0, 0, 0, 0, 0, 0, 0, 0, 1, 1, 1, 1, 1, 1, 1, 0, 0, 0, 0]",179
134,QID789,135,A truly wonderful tale combined with stunning animation.,positive,positive,1,wonderful,[2],24,Black/African American,Female,Very well,PASSED,493,BY,Black/African American,<=35,14072,train,"[0, 0, 1, 0, 0, 0, 0, 0]",193
135,QID841,161,It will guarantee to have you leaving the theater with a smile on your face.,positive,positive,1,"guarantee,smile","[2, 11]",22,African,Female,Very well,PASSED,527,BY,Black/African American,<=35,14614,train,"[0, 0, 1, 0, 0, 0, 0, 0, 0, 0, 0, 1, 0, 0, 0]",202
136,QID791,136,"Nothing sticks, really, except a lingering creepiness one feels from being dragged through a sad, sordid universe of guns, drugs, avarice and damaged dreams.",negative,negative,2,"Nothing,sticks,,creepiness,dragged,guns,,drugs,,damaged","[0, 1, 6, 11, 18, 19, 22]",24,Black/African American,Female,Very well,PASSED,494,BY,Black/African American,<=35,14756,train,"[1, 1, 0, 0, 0, 0, 1, 0, 0, 0, 0, 1, 0, 0, 0, 0, 0, 0, 1, 1, 0, 0, 1, 0]",193
137,QID717,99,"Loud, chaotic and largely unfunny.",negative,negative,2,"Loud,,chaotic,unfunny.","[0, 1, 4]",23,Black/African American,Female,Very well,PASSED,448,BY,Black/African American,<=35,14768,train,"[1, 1, 0, 0, 1]",108
138,QID847,164,"Measured against practically any like-themed film other than its Oscar-sweeping franchise predecessor The Silence of the Lambs, Red Dragon rates as an exceptional thriller.",positive,positive,1,exceptional,[22],22,African,Female,Very well,PASSED,531,BY,Black/African American,<=35,15390,train,"[0, 0, 0, 0, 0, 0, 0, 0, 0, 0, 0, 0, 0, 0, 0, 0, 0, 0, 0, 0, 0, 0, 1, 0]",202
141,QID1021,251,But what's nice is that there's a casual intelligence that permeates the script.,positive,positive,1,"casual,intelligence","[7, 8]",27,Black/African American,Male,Very well,PASSED,683,BY,Black/African American,<=35,16046,train,"[0, 0, 0, 0, 0, 0, 0, 1, 1, 0, 0, 0, 0]",143
142,QID939,210,"The film feels formulaic, its plot and pacing typical Hollywood war-movie stuff, while the performances elicit more of a sense of deja vu than awe.",negative,negative,2,"formulaic,,typical,than","[3, 8, 23]",26,African,Female,Very well,PASSED,615,BY,Black/African American,<=35,16051,train,"[0, 0, 0, 1, 0, 0, 0, 0, 1, 0, 0, 0, 0, 0, 0, 0, 0, 0, 0, 0, 0, 0, 0, 1, 0]",114
143,QID607,44,"It is supremely unfunny and unentertaining to watch middle-age and older men drink to excess, piss on trees, b.s. one another and put on a show in drag.",negative,negative,2,"supremely,unfunny,unentertaining,to,watch,middle-age,older,men,drink,excess,,piss,on,trees,,b.s.,one,another,drag.","[2, 3, 5, 6, 7, 8, 10, 11, 12, 14, 15, 16, 17, 18, 19, 20, 27]",25,African,Female,Very well,PASSED,368,BY,Black/African American,<=35,16421,train,"[0, 0, 1, 1, 0, 1, 1, 1, 1, 0, 1, 1, 1, 0, 1, 1, 1, 1, 1, 1, 1, 0, 0, 0, 0, 0, 0, 1]",174
144,QID563,22,"... a plotline that's as lumpy as two-day old porridge... the filmmakers' paws, sad to say, were all over this ``un-bear-able'' project!",negative,negative,2,"sad,were,all,over,this,``un-bear-able'',project!","[13, 16, 17, 18, 19, 20, 21]",27,Black/African American,Female,Very well,PASSED,338,BY,Black/African American,<=35,16890,train,"[0, 0, 0, 0, 0, 0, 0, 0, 0, 0, 0, 0, 0, 1, 0, 0, 1, 1, 1, 1, 1, 1]",164
145,QID871,176,The original wasn't a good movie but this remake makes it look like a masterpiece!,negative,negative,2,"original,wasn't,good,remake,makes,it,look,like,a,masterpiece!","[1, 2, 4, 8, 9, 10, 11, 12, 13, 14]",30,African,Male,Very well,PASSED,550,BY,Black/African American,<=35,16934,train,"[0, 1, 1, 0, 1, 0, 0, 0, 1, 1, 1, 1, 1, 1, 1]",179
146,QID887,184,The Pianist is Polanski's best film.,positive,positive,1,"Pianist,Polanski's,best,film.","[1, 3, 4, 5]",32,African,Female,Very well,PASSED,566,BY,Black/African American,<=35,17534,train,"[0, 1, 0, 1, 1, 1]",198
147,QID995,238,"A gratingly unfunny groaner littered with zero-dimensional, unlikable characters and hackneyed, threadbare comic setups.",negative,negative,2,"unfunny,zero-dimensional,,unlikable,characters,hackneyed,,threadbare","[2, 6, 7, 8, 10, 11]",25,African,Female,Very well,PASSED,665,BY,Black/African American,<=35,17684,train,"[0, 0, 1, 0, 0, 0, 1, 1, 1, 0, 1, 1, 0, 0]",169
148,QID1039,260,"It's a head-turner -- thoughtfully written, beautifully read and, finally, deeply humanizing.",positive,positive,1,"head-turner,beautifully,deeply,humanizing.","[2, 6, 10, 11]",30,African,Male,Very well,PASSED,695,BY,Black/African American,<=35,18114,train,"[0, 0, 1, 0, 0, 0, 1, 0, 0, 0, 1, 1]",127
149,QID967,224,Distinctly sub-par... more likely to drown a viewer in boredom than to send any shivers down his spine.,negative,negative,2,"sub-par...,drown,boredom","[1, 5, 9]",27,African,Female,Very well,PASSED,643,BY,Black/African American,<=35,19252,train,"[0, 1, 0, 0, 0, 1, 0, 0, 0, 1, 0, 0, 0, 0, 0, 0, 0, 0]",197
150,QID1029,255,"Every individual will see the movie through the prism of his or her own beliefs and prejudices, but the one thing most will take away is the sense that peace is possible.",positive,no sentiment,3,"Every,individual,will,see,own,beliefs,and,prejudices,","[0, 1, 2, 3, 13, 14, 15, 16]",30,African,Male,Very well,PASSED,687,BY,Black/African American,<=35,21374,train,"[1, 1, 1, 1, 0, 0, 0, 0, 0, 0, 0, 0, 0, 1, 1, 1, 1, 0, 0, 0, 0, 0, 0, 0, 0, 0, 0, 0, 0, 0, 0, 0]",127
152,QID641,61,Read My Lips is to be viewed and treasured for its extraordinary intelligence and originality as well as its lyrical variations on the game of love.,positive,positive,1,"treasured,extraordinary,intelligence,originality","[8, 11, 12, 14]",27,African,Female,Very well,PASSED,391,BY,Black/African American,<=35,22075,train,"[0, 0, 0, 0, 0, 0, 0, 0, 1, 0, 0, 1, 1, 0, 1, 0, 0, 0, 0, 0, 0, 0, 0, 0, 0, 0]",123
155,QID897,189,"A lot of talent is wasted in this crass, low-wattage endeavor.",negative,negative,2,"lot,talent,wasted,crass,,low-wattage,endeavor.","[1, 3, 5, 8, 9, 10]",32,African,Female,Very well,PASSED,574,BY,Black/African American,<=35,22817,train,"[0, 1, 0, 1, 0, 1, 0, 0, 1, 1, 1]",198
156,QID557,19,"What makes How I Killed My Father compelling, besides its terrific performances, is Fontaine's willingness to wander into the dark areas of parent-child relationships without flinching.",positive,positive,1,"compelling,,terrific,performances,","[7, 10, 11]",27,African,Male,Very well,PASSED,335,BY,Black/African American,<=35,22843,train,"[0, 0, 0, 0, 0, 0, 0, 1, 0, 0, 1, 1, 0, 0, 0, 0, 0, 0, 0, 0, 0, 0, 0, 0, 0, 0]",144
157,QID525,3,Exudes the fizz of a Busby Berkeley musical and the visceral excitement of a sports extravaganza.,positive,positive,1,visceral,[10],31,African,Female,Well,PASSED,305,BY,Black/African American,<=35,22941,train,"[0, 0, 0, 0, 0, 0, 0, 0, 0, 0, 1, 0, 0, 0, 0, 0]",173
158,QID931,206,"A dim-witted and lazy spin-off of the Animal Planet documentary series, Crocodile Hunter is entertainment opportunism at its most glaring.",negative,negative,2,"dim-witted,lazy,spin-off,opportunism","[1, 3, 4, 15]",34,Black/African American,Female,Very well,PASSED,610,BY,Black/African American,<=35,23110,train,"[0, 1, 0, 1, 1, 0, 0, 0, 0, 0, 0, 0, 0, 0, 0, 1, 0, 0, 0, 0]",145
160,QID949,215,"This is an extraordinary film, not least because it is Japanese and yet feels universal.",positive,positive,1,"extraordinary,feels,universal.","[3, 13, 14]",26,African,Female,Very well,PASSED,623,BY,Black/African American,<=35,24602,train,"[0, 0, 0, 1, 0, 0, 0, 0, 0, 0, 0, 0, 0, 1, 1]",114
162,QID697,89,"Thanks to a small star with big heart, this family film sequel is plenty of fun for all.",positive,positive,1,"Thanks,big,heart,,family,fun","[0, 6, 7, 9, 15]",30,African,Male,Well,PASSED,432,BY,Black/African American,<=35,24787,train,"[1, 0, 0, 0, 0, 0, 1, 1, 0, 1, 0, 0, 0, 0, 0, 1, 0, 0]",150
163,QID1041,261,"Bray is completely at sea; with nothing but a Savage Garden music video on his resume, he has no clue about making a movie.",negative,no sentiment,3,"is,at,with,he,has,no","[1, 3, 5, 16, 17, 18]",30,African,Male,Very well,PASSED,696,BY,Black/African American,<=35,24788,train,"[0, 1, 0, 1, 0, 1, 0, 0, 0, 0, 0, 0, 0, 0, 0, 0, 1, 1, 1, 0, 0, 0, 0, 0]",127
165,QID991,236,"Co-writer/director Jonathan Parker's attempts to fashion a Brazil-like, hyper-real satire fall dreadfully short.",negative,negative,2,"attempts,to,fashion,a,Brazil-like,,hyper-real,satire,fall,dreadfully,short.","[3, 4, 5, 6, 7, 8, 9, 10, 11, 12]",25,African,Female,Very well,PASSED,662,BY,Black/African American,<=35,25097,train,"[0, 0, 0, 1, 1, 1, 1, 1, 1, 1, 1, 1, 1]",169
166,QID993,237,"An amateurish, quasi-improvised acting exercise shot on ugly digital video.",negative,negative,2,"amateurish,,quasi-improvised,acting,shot,on,ugly,digital,video.","[1, 2, 3, 5, 6, 7, 8, 9]",25,African,Female,Very well,PASSED,663,BY,Black/African American,<=35,25253,train,"[0, 1, 1, 1, 0, 1, 1, 1, 1, 1]",169
167,QID579,30,"At times, the movie looks genuinely pretty.",positive,positive,1,"looks,genuinely,pretty.","[4, 5, 6]",21,Black/African American,Female,Very well,PASSED,347,BY,Black/African American,<=35,25338,train,"[0, 0, 0, 0, 1, 1, 1]",101
168,QID901,191,This stuck pig of a movie flails limply between bizarre comedy and pallid horror.,negative,negative,2,pig,[2],23,African,Female,Very well,PASSED,577,BY,Black/African American,<=35,25694,train,"[0, 0, 1, 0, 0, 0, 0, 0, 0, 0, 0, 0, 0, 0]",131
169,QID881,181,The most compelling performance of the year adds substantial depth to this shocking testament to anti-Semitism and neo-fascism.,positive,negative,2,"shocking,anti-Semitism,neo-fascism.","[12, 15, 17]",32,African,Female,Very well,PASSED,559,BY,Black/African American,<=35,26146,train,"[0, 0, 0, 0, 0, 0, 0, 0, 0, 0, 0, 0, 1, 0, 0, 1, 0, 1]",198
171,QID681,81,"No French people were harmed during the making of this movie, but they were insulted and the audience was put through torture for an hour and a half.",negative,negative,2,"insulted,torture","[14, 21]",30,African,Male,Well,PASSED,419,BY,Black/African American,<=35,27443,train,"[0, 0, 0, 0, 0, 0, 0, 0, 0, 0, 0, 0, 0, 0, 1, 0, 0, 0, 0, 0, 0, 1, 0, 0, 0, 0, 0, 0]",150
172,QID585,33,"Sparkling, often hilarious romantic jealousy comedy... Attal looks so much like a young Robert DeNiro that it seems the film should instead be called `My Husband Is Travis Bickle'.",positive,positive,1,"Sparkling,,often,hilarious","[0, 1, 2]",21,Black/African American,Female,Very well,PASSED,351,BY,Black/African American,<=35,27502,train,"[1, 1, 1, 0, 0, 0, 0, 0, 0, 0, 0, 0, 0, 0, 0, 0, 0, 0, 0, 0, 0, 0, 0, 0, 0, 0, 0, 0, 0]",101
173,QID925,203,"This enthralling documentary... is at once playful and haunting, an in-depth portrait of an iconoclastic artist who was fundamentally unknowable even to his closest friends.",positive,no sentiment,3,in-depth,[10],34,Black/African American,Female,Very well,PASSED,603,BY,Black/African American,<=35,27544,train,"[0, 0, 0, 0, 0, 0, 0, 0, 0, 0, 1, 0, 0, 0, 0, 0, 0, 0, 0, 0, 0, 0, 0, 0, 0]",145
174,QID821,151,"It's difficult to conceive of anyone who has reached puberty actually finding the characters in Slackers or their antics amusing, let alone funny.",negative,negative,2,"their,antics,amusing,,let,alone,funny.","[17, 18, 19, 20, 21, 22]",34,Black/African American,Male,Very well,PASSED,513,BY,Black/African American,<=35,27649,train,"[0, 0, 0, 0, 0, 0, 0, 0, 0, 0, 0, 0, 0, 0, 0, 0, 0, 1, 1, 1, 1, 1, 1]",141
175,QID1027,254,"This picture is murder by numbers, and as easy to be bored by as your ABC's, despite a few whopping shootouts.",negative,negative,2,"easy,to,be,bored","[8, 9, 10, 11]",30,African,Male,Very well,PASSED,686,BY,Black/African American,<=35,27797,train,"[0, 0, 0, 0, 0, 0, 0, 0, 1, 1, 1, 1, 0, 0, 0, 0, 0, 0, 0, 0, 0]",127
176,QID707,94,What should have been a cutting Hollywood satire is instead about as fresh as last week's issue of Variety.,negative,negative,2,"as,fresh,as,last,week's,issue,of,Variety.","[11, 12, 13, 14, 15, 16, 17, 18]",23,Black/African American,Female,Very well,PASSED,441,BY,Black/African American,<=35,28024,train,"[0, 0, 0, 0, 0, 0, 0, 0, 0, 0, 0, 1, 1, 1, 1, 1, 1, 1, 1]",108
177,QID625,53,... a bland murder-on-campus yawner.,negative,negative,2,"murder-on-campus,yawner.","[3, 4]",30,African,Female,Very well,PASSED,380,BY,Black/African American,<=35,28089,train,"[0, 0, 0, 1, 1]",138
178,QID845,163,"A thoroughly awful movie -- dumb, narratively chaotic, visually sloppy... a weird amalgam of `The Thing' and a geriatric `Scream.'",negative,negative,2,"awful,dumb,,chaotic,,sloppy...,weird","[2, 5, 7, 9, 11]",22,African,Female,Very well,PASSED,529,BY,Black/African American,<=35,28444,train,"[0, 0, 1, 0, 0, 1, 0, 1, 0, 1, 0, 1, 0, 0, 0, 0, 0, 0, 0, 0]",202
179,QID777,129,Audiard successfully maintains suspense on different levels throughout a film that is both gripping and compelling.,positive,positive,1,"successfully,gripping,compelling.","[1, 13, 15]",24,African,Male,Very well,PASSED,485,BY,Black/African American,<=35,29160,train,"[0, 1, 0, 0, 0, 0, 0, 0, 0, 0, 0, 0, 0, 1, 0, 1]",165
180,QID565,23,Crush could be the worst film a man has made about women since Valley of the Dolls.,negative,negative,2,"worst,film,man,has,made","[4, 5, 7, 8, 9]",27,Black/African American,Female,Very well,PASSED,339,BY,Black/African American,<=35,29269,train,"[0, 0, 0, 0, 1, 1, 0, 1, 1, 1, 0, 0, 0, 0, 0, 0, 0]",164
181,QID915,198,A movie so bad that it quickly enters the pantheon of wreckage that includes Battlefield Earth and Showgirls.,negative,negative,2,bad,[3],23,African,Female,Very well,PASSED,595,BY,Black/African American,<=35,29702,train,"[0, 0, 0, 1, 0, 0, 0, 0, 0, 0, 0, 0, 0, 0, 0, 0, 0, 0]",131
182,QID1033,257,"Starts out mediocre, spirals downward, and thuds to the bottom of the pool with an utterly incompetent conclusion.",negative,negative,2,"mediocre,,spirals,downward,,utterly,incompetent","[2, 3, 4, 15, 16]",30,African,Male,Very well,PASSED,691,BY,Black/African American,<=35,29721,train,"[0, 0, 1, 1, 1, 0, 0, 0, 0, 0, 0, 0, 0, 0, 0, 1, 1, 0]",127
183,QID611,46,"Whatever heartwarming scene the impressively discreet filmmakers may have expected to record with their mini DV, they show a remarkable ability to document both sides of this emotional car-wreck.",positive,positive,1,"heartwarming,scene,impressively,discreet,remarkable,ability,emotional,car-wreck.","[1, 2, 4, 5, 19, 20, 27, 28]",25,African,Female,Very well,PASSED,371,BY,Black/African American,<=35,30034,train,"[0, 1, 1, 0, 1, 1, 0, 0, 0, 0, 0, 0, 0, 0, 0, 0, 0, 0, 0, 1, 1, 0, 0, 0, 0, 0, 0, 1, 1]",174
184,QID627,54,In comparison to his earlier films it seems a disappointingly thin slice of lower-class London life; despite the title... amounts to surprisingly little.,negative,negative,2,disappointingly,[9],30,African,Female,Very well,PASSED,381,BY,Black/African American,<=35,30183,train,"[0, 0, 0, 0, 0, 0, 0, 0, 0, 1, 0, 0, 0, 0, 0, 0, 0, 0, 0, 0, 0, 0, 0]",138
185,QID963,222,An exhilarating experience.,positive,positive,1,exhilarating,[1],27,African,Female,Very well,PASSED,639,BY,Black/African American,<=35,31302,train,"[0, 1, 0]",197
187,QID835,158,"After sitting through this sloppy, made-for-movie comedy special, it makes me wonder if Lawrence hates criticism so much that he refuses to evaluate his own work.",negative,negative,2,"this,sloppy,,makes,me,wonder","[3, 4, 9, 10, 11]",34,Black/African American,Male,Very well,PASSED,523,BY,Black/African American,<=35,32055,train,"[0, 0, 0, 1, 1, 0, 0, 0, 0, 1, 1, 1, 0, 0, 0, 0, 0, 0, 0, 0, 0, 0, 0, 0, 0, 0]",141
188,QID753,117,"A bittersweet contemporary comedy about benevolent deception, which, while it may not rival the filmmaker's period pieces, is still very much worth seeing.",positive,no sentiment,3,"bittersweet,contemporary","[1, 2]",32,African,Female,Very well,PASSED,468,BY,Black/African American,<=35,32190,train,"[0, 1, 1, 0, 0, 0, 0, 0, 0, 0, 0, 0, 0, 0, 0, 0, 0, 0, 0, 0, 0, 0, 0]",192
189,QID829,155,It's a funny little movie with clever dialogue and likeable characters.,positive,positive,1,"funny,little,movie,with,clever,dialogue,likeable,characters.","[2, 3, 4, 5, 6, 7, 9, 10]",34,Black/African American,Male,Very well,PASSED,518,BY,Black/African American,<=35,32851,train,"[0, 0, 1, 1, 1, 1, 1, 1, 0, 1, 1]",141
190,QID703,92,"For those for whom the name Woody Allen was once a guarantee of something fresh, sometimes funny, and usually genuinely worthwhile, Hollywood Ending is a depressing experience.",negative,negative,2,"depressing,experience.","[25, 26]",23,Black/African American,Female,Very well,PASSED,438,BY,Black/African American,<=35,33235,train,"[0, 0, 0, 0, 0, 0, 0, 0, 0, 0, 0, 0, 0, 0, 0, 0, 0, 0, 0, 0, 0, 0, 0, 0, 0, 1, 1]",108
